{
  "schema_version": "0.3-draft",
  "notes": "v0.3: role_events化(閾値定義をカタログに集約)、pull追加、llm_select_hint追加、phase_locked追加。実手持ちはinventory.jsonと照合。登録外部品は子ども向けUIで使わせない。",
  "safe_level_definition": {
    "1": "画面だけ、または低リスク。子ども単独でも選択可",
    "2": "3.3V低電流。配線は大人と一緒推奨",
    "3": "センサー/通信あり。写真チェック推奨",
    "4": "5V・サーボ・LEDリング等。大人チェック必須",
    "5": "外部電源/モーター/高電流等。Phase 1-2では原則非対応"
  },
  "parts": [
    {
      "part_id": "pico2w",
      "name_kids": "🧠 Pico 2 W",
      "category": "controller",
      "interface": "gpio",
      "role": "controller",
      "voltage": "3v3_logic",
      "current_draw_ma_typ": 80,
      "adult_required": true,
      "safe_level": 3,
      "notes": "制御本体。子ども画面では安全な候補ピンだけを割り当てる。"
    },
    {
      "part_id": "button",
      "name_kids": "🔘 ボタン",
      "category": "input",
      "interface": "digital_gpio",
      "role": "input",
      "voltage": "3v3",
      "pull": "internal",
      "pins_required": { "signal": 1, "gnd": 1 },
      "current_draw_ma_typ": 1,
      "role_events": {
        "press":        {},
        "release":      {},
        "long_press":   { "param": "hold_ms", "default": 800, "min": 300, "max": 3000, "unit": "ms" },
        "double_press": {}
      },
      "adult_required": false,
      "safe_level": 2,
      "max_count": 4,
      "notes": "内部プルアップ使用。片足→GPxx / もう片足→GND。外付け抵抗不要。"
    },
    {
      "part_id": "single_led",
      "name_kids": "💡 LED",
      "category": "output",
      "interface": "digital_gpio",
      "role": "output",
      "voltage": "3v3",
      "pins_required": { "signal": 1, "gnd": 1, "resistor": "220ohm_required" },
      "current_draw_ma_typ": 5,
      "actions": ["on", "off", "blink"],
      "adult_required": false,
      "safe_level": 2,
      "max_count": 4,
      "llm_select_hint": "1色だけ光る普通のLED。色を変えたいならRGB LED、派手にたくさん光らせたいならピカピカリング。",
      "notes": "抵抗必須。写真チェックで抵抗値はAI単独判定しない。"
    },
    {
      "part_id": "rgb_led_4pin",
      "name_kids": "🌈 RGB LED",
      "category": "output",
      "interface": "pwm_gpio",
      "role": "output",
      "voltage": "3v3",
      "pins_required": { "r": 1, "g": 1, "b": 1, "gnd_or_vcc": 1, "resistor": "per_channel" },
      "current_draw_ma_typ": 15,
      "actions": ["set_color", "blink", "off"],
      "adult_required": true,
      "safe_level": 3,
      "max_count": 1,
      "llm_select_hint": "1個で色が自由に変わるライト。たくさん並べて派手に光らせたい時はピカピカリング(neopixel_ring_12)を使う。"
    },
    {
      "part_id": "active_buzzer",
      "name_kids": "🔊 ブザー",
      "category": "output",
      "interface": "digital_gpio",
      "role": "output",
      "voltage": "3v3_or_5v_by_model",
      "pins_required": { "signal": 1, "gnd": 1 },
      "current_draw_ma_typ": 20,
      "actions": ["beep", "off"],
      "adult_required": true,
      "safe_level": 3,
      "max_count": 1,
      "notes": "音量・電圧は部品による。夜間や長時間連続音は禁止。"
    },
    {
      "part_id": "servo_sg90",
      "name_kids": "🦾 サーボ",
      "category": "actuator",
      "interface": "pwm_gpio",
      "role": "output",
      "voltage": "5v",
      "pins_required": { "signal": 1, "power": "5v_external_recommended", "gnd": 1 },
      "current_draw_ma_typ": 150,
      "current_draw_ma_peak": 650,
      "actions": ["move", "sweep", "stop"],
      "adult_required": true,
      "safe_level": 4,
      "phase_locked": true,
      "max_count": 1,
      "notes": "5V系。USB給電だけで動かす前提にしない。Phase1-2ではグレーアウト。動作角度・速度を制限する。"
    },
    {
      "part_id": "neopixel_ring_12",
      "name_kids": "💎 ピカピカリング",
      "category": "output",
      "interface": "one_wire_timing",
      "role": "output",
      "voltage": "5v",
      "level_shift_required": true,
      "pins_required": { "signal": 1, "power": "5v_external", "gnd": 1 },
      "current_draw_ma_typ": 120,
      "current_draw_ma_max": 720,
      "actions": ["set_color", "rainbow", "sparkle", "off"],
      "adult_required": true,
      "safe_level": 4,
      "phase_locked": true,
      "max_count": 1,
      "llm_select_hint": "LEDが12個並んで派手に光るリング。1個だけ色を変えたいならRGB LED(rgb_led_4pin)を使う。",
      "notes": "5V系。74HCT125等のレベルシフタ推奨。明るさ上限をソフトで制限。Phase1-2ではグレーアウト。"
    },
    {
      "part_id": "tcs34725_color",
      "name_kids": "🎨 いろセンサー",
      "category": "sensor",
      "interface": "i2c",
      "role": "input",
      "voltage": "3v3",
      "i2c_address": "0x29",
      "i2c_address_alt": [],
      "pins_required": { "sda": 1, "scl": 1, "power": "3v3", "gnd": 1 },
      "current_draw_ma_typ": 3,
      "role_events": {
        "color_red":       {},
        "color_blue":      {},
        "color_green":     {},
        "brightness_high": { "param": "level", "default": 70, "min": 0, "max": 100, "unit": "percent" },
        "brightness_low":  { "param": "level", "default": 30, "min": 0, "max": 100, "unit": "percent" }
      },
      "adult_required": false,
      "safe_level": 3,
      "max_count": 1,
      "notes": "VL53L0Xと同じ0x29。併用時はアドレス再割当または組み合わせ注意（vl53l0x側を0x30へ）。"
    },
    {
      "part_id": "vl53l0x_distance",
      "name_kids": "📏 きょりセンサー",
      "category": "sensor",
      "interface": "i2c",
      "role": "input",
      "voltage": "3v3",
      "i2c_address": "0x29",
      "i2c_address_alt": ["0x30"],
      "pins_required": { "sda": 1, "scl": 1, "power": "3v3", "gnd": 1, "xshut": 1 },
      "current_draw_ma_typ": 20,
      "role_events": {
        "distance_near":    { "param": "threshold_cm", "default": 20, "min": 5,  "max": 100, "unit": "cm" },
        "distance_far":     { "param": "threshold_cm", "default": 50, "min": 5,  "max": 200, "unit": "cm" },
        "distance_changed": {}
      },
      "adult_required": false,
      "safe_level": 3,
      "max_count": 2,
      "notes": "TCS34725と同じ0x29。併用時はXSHUTで0x30へ再割当。"
    },
    {
      "part_id": "photoresistor",
      "name_kids": "☀️ あかるさセンサー",
      "category": "sensor",
      "interface": "analog_gpio",
      "role": "input",
      "voltage": "3v3",
      "pins_required": { "adc": 1, "power": "3v3", "gnd": 1, "resistor": "divider_required" },
      "current_draw_ma_typ": 1,
      "role_events": {
        "light_high": { "param": "level", "default": 70, "min": 0, "max": 100, "unit": "percent" },
        "light_low":  { "param": "level", "default": 30, "min": 0, "max": 100, "unit": "percent" }
      },
      "adult_required": true,
      "safe_level": 3,
      "max_count": 1
    },
    {
      "part_id": "potentiometer",
      "name_kids": "🎚️ つまみ",
      "category": "input",
      "interface": "analog_gpio",
      "role": "input",
      "voltage": "3v3",
      "pins_required": { "adc": 1, "power": "3v3", "gnd": 1 },
      "current_draw_ma_typ": 1,
      "role_events": {
        "value_changed": {},
        "value_high":    { "param": "level", "default": 70, "min": 0, "max": 100, "unit": "percent" },
        "value_low":     { "param": "level", "default": 30, "min": 0, "max": 100, "unit": "percent" }
      },
      "adult_required": true,
      "safe_level": 3,
      "max_count": 2
    },
    {
      "part_id": "oled_i2c_096",
      "name_kids": "📺 ちいさい画面",
      "category": "output",
      "interface": "i2c",
      "role": "output",
      "voltage": "3v3_or_5v_by_model",
      "i2c_address": "0x3C",
      "pins_required": { "sda": 1, "scl": 1, "power": "3v3_or_5v_by_model", "gnd": 1 },
      "current_draw_ma_typ": 20,
      "actions": ["show_text", "show_icon", "clear"],
      "adult_required": true,
      "safe_level": 3,
      "max_count": 1
    }
  ],
  "disallowed_or_later": [
    { "item": "100V/AC mains",        "reason": "子ども向け発明モードでは完全NG" },
    { "item": "リチウム電池の直配線",   "reason": "保護回路・充電管理が必要。Phase 1-2ではNG" },
    { "item": "ヒーター/発熱体",       "reason": "火傷・火災リスク" },
    { "item": "ポンプ/水回り",         "reason": "漏電・水濡れリスク。別設計が必要" },
    { "item": "大型モーター",          "reason": "高電流・巻き込みリスク" }
  ]
}
